<?xml version="1.0" encoding="UTF-8"?>
<xs:schema xmlns:xs="http://www.w3.org/2001/XMLSchema"
           targetNamespace="http://example.com/inventory"
           xmlns:inv="http://example.com/inventory"
           elementFormDefault="qualified">

    <xs:element name="inventoryUpdates">
        <xs:complexType>
            <xs:sequence>
                <xs:element name="inventoryUpdate" type="inv:inventoryUpdateType" minOccurs="0" maxOccurs="unbounded"/>
            </xs:sequence>
        </xs:complexType>
    </xs:element>

    <xs:complexType name="inventoryUpdateType">
        <xs:sequence>
            <xs:element name="updateId" type="xs:string"/>
            <xs:element name="warehouseId" type="xs:string"/>
            <xs:element name="productId" type="xs:string"/>
            <xs:element name="quantityChange" type="xs:integer"/>
            <xs:element name="updateTimestamp" type="xs:dateTime"/>
            <xs:element name="updateType" type="inv:updateTypeEnum"/>
        </xs:sequence>
    </xs:complexType>

    <xs:simpleType name="updateTypeEnum">
        <xs:restriction base="xs:string">
            <xs:enumeration value="ADD"/>
            <xs:enumeration value="REMOVE"/>
            <xs:enumeration value="ADJUST"/>
        </xs:restriction>
    </xs:simpleType>

</xs:schema>