<?xml version="1.0" encoding="UTF-8"?>
<inv:inventoryUpdates xmlns:inv="http://example.com/schemas/inventory"
                      xmlns:xsi="http://www.w3.org/2001/XMLSchema-instance"
                      xsi:schemaLocation="http://example.com/schemas/inventory ../../schemas/inventory_update.xsd">
    
    <inv:inventoryUpdate>
        <wrh:updateId>UPD-2024-001</wrh:updateId>
        <inv:warehouseId>WH-EAST-01</inv:warehouseId>
        <inv:productId>PRD-8847-A</inv:productId>
        <inv:quantityChange>150</inv:quantityChange>
        <inv:updateTimestamp>2024-01-15T08:30:00Z</inv:updateTimestamp>
        <inv:updateType>RESTOCK</inv:updateType>
    </inv:inventoryUpdate>
    
    <inv:inventoryUpdate>
        <wrh:updateId>UPD-2024-002</wrh:updateId>
        <inv:warehouseId>WH-WEST-03</inv:warehouseId>
        <inv:productId>PRD-2193-B</inv:productId>
        <inv:quantityChange>-45</inv:quantityChange>
        <inv:updateTimestamp>2024-01-15T09:15:00Z</inv:updateTimestamp>
        <inv:updateType>SALE</inv:updateType>
    </inv:inventoryUpdate>
    
    <inv:inventoryUpdate>
        <wrh:updateId>UPD-2024-003</wrh:updateId>
        <inv:warehouseId>WH-CENTRAL-02</inv:warehouseId>
        <inv:productId>PRD-5521-C</inv:productId>
        <inv:quantityChange>-12</inv:quantityChange>
        <inv:updateTimestamp>2024-01-15T10:45:00Z</inv:updateTimestamp>
        <inv:updateType>DAMAGE</inv:updateType>
    </inv:inventoryUpdate>
    
    <inv:inventoryUpdate>
        <wrh:updateId>UPD-2024-004</wrh:updateId>
        <inv:warehouseId>WH-SOUTH-05</inv:warehouseId>
        <inv:productId>PRD-7736-D</inv:productId>
        <inv:quantityChange>300</inv:quantityChange>
        <inv:updateTimestamp>2024-01-15T11:20:00Z</inv:updateTimestamp>
        <inv:updateType>RESTOCK</inv:updateType>
    </inv:inventoryUpdate>
    
    <inv:inventoryUpdate>
        <wrh:updateId>UPD-2024-005</wrh:updateId>
        <inv:warehouseId>WH-NORTH-04</inv:warehouseId>
        <inv:productId>PRD-4429-E</inv:productId>
        <inv:quantityChange>-78</inv:quantityChange>
        <inv:updateTimestamp>2024-01-15T13:00:00Z</inv:updateTimestamp>
        <inv:updateType>SALE</inv:updateType>
    </inv:inventoryUpdate>

</inv:inventoryUpdates>